{
  "event_id": "evt_6fdc4dd45ba14882",
  "schema_version": "v1",
  "event_type": "asset.discovered",
  "occurred_at": "2026-07-14T07:47:30.774232Z",
  "asset": {
    "provider": "github",
    "owner": "qt314wink",
    "repo": "neon-gothic-kintsugi",
    "commit_sha": "2026-06-01T21:53:33Z",
    "ref": "master"
  },
  "actor": {
    "type": "workflow",
    "id": "collect_repo_provenance"
  },
  "confidence": "supported",
  "claims": {
    "github_repo_id": 1248041586,
    "github_node_id": "R_kgDOSmOacg",
    "language": "HTML",
    "archived": false,
    "private": false,
    "fork": false,
    "description": null,
    "pushed_at": "2026-06-01T21:53:33Z",
    "created_at": "2026-05-24T05:32:28Z",
    "open_issues_count": 1
  }
}