{
  "event_id": "evt_8e7292bbd724992c",
  "schema_version": "v1",
  "event_type": "asset.discovered",
  "occurred_at": "2026-08-31T12:09:28.846372Z",
  "asset": {
    "provider": "github",
    "owner": "qt314wink",
    "repo": "neobrutalism-lab",
    "commit_sha": "2026-08-31T06:35:06Z",
    "ref": "main"
  },
  "actor": {
    "type": "workflow",
    "id": "collect_repo_provenance"
  },
  "confidence": "supported",
  "claims": {
    "github_repo_id": 1330970537,
    "github_node_id": "R_kgDOT1T_qQ",
    "language": "TypeScript",
    "archived": false,
    "private": false,
    "fork": false,
    "description": null,
    "pushed_at": "2026-08-31T06:35:06Z",
    "created_at": "2026-08-11T13:41:38Z",
    "open_issues_count": 2
  }
}