{
  "event_id": "evt_2cf7cc6645daebdc",
  "schema_version": "v1",
  "event_type": "asset.discovered",
  "occurred_at": "2026-09-03T10:23:06.618612Z",
  "asset": {
    "provider": "github",
    "owner": "qt314wink",
    "repo": "aurora-collage-ui-system",
    "commit_sha": "2026-09-03T07:25:33Z",
    "ref": "main"
  },
  "actor": {
    "type": "workflow",
    "id": "collect_repo_provenance"
  },
  "confidence": "supported",
  "claims": {
    "github_repo_id": 1279964348,
    "github_node_id": "R_kgDOTEq0vA",
    "language": null,
    "archived": false,
    "private": false,
    "fork": false,
    "description": "AURORA Collage UI System \u2014 Production-ready Vite React design system with lithographic texture, risograph ink, newspaper collage, watercolor washes, and papercraft assemblage aesthetics.",
    "pushed_at": "2026-09-03T07:25:33Z",
    "created_at": "2026-06-25T06:44:12Z",
    "open_issues_count": 2
  }
}