{
  "event_id": "evt_1496fe16daeb4ffa",
  "schema_version": "v1",
  "event_type": "asset.discovered",
  "occurred_at": "2026-09-01T10:46:30.097285Z",
  "asset": {
    "provider": "github",
    "owner": "qt314wink",
    "repo": "beats-and-boxes",
    "commit_sha": "2026-07-06T09:01:05Z",
    "ref": "main"
  },
  "actor": {
    "type": "workflow",
    "id": "collect_repo_provenance"
  },
  "confidence": "supported",
  "claims": {
    "github_repo_id": 1247977232,
    "github_node_id": "R_kgDOSmKfEA",
    "language": null,
    "archived": false,
    "private": false,
    "fork": false,
    "description": "Beats & Boxes \u2014 a Philadelphia community music initiative blending EDM culture, regenerative systems, and local creative infrastructure.",
    "pushed_at": "2026-07-06T09:01:05Z",
    "created_at": "2026-05-24T03:01:09Z",
    "open_issues_count": 0
  }
}