{
  "event_id": "evt_94ea7a9118a35406",
  "schema_version": "v1",
  "event_type": "asset.discovered",
  "occurred_at": "2026-08-13T07:12:36.674337Z",
  "asset": {
    "provider": "github",
    "owner": "qt314wink",
    "repo": "flore-orthography-memphis-ui",
    "commit_sha": "2026-08-12T21:45:16Z",
    "ref": "main"
  },
  "actor": {
    "type": "workflow",
    "id": "collect_repo_provenance"
  },
  "confidence": "supported",
  "claims": {
    "github_repo_id": 1280131691,
    "github_node_id": "R_kgDOTE1Caw",
    "language": "TypeScript",
    "archived": false,
    "private": false,
    "fork": false,
    "description": "FLOR\u00c9 \u2014 Orthography \u00d7 Memphis \u00d7 Illustrated Floral \u00d7 Impasto UI System",
    "pushed_at": "2026-08-12T21:45:16Z",
    "created_at": "2026-06-25T09:48:03Z",
    "open_issues_count": 8
  }
}