{
  "event_id": "evt_6ebd1a95810aef88",
  "schema_version": "v1",
  "event_type": "asset.discovered",
  "occurred_at": "2026-09-01T10:46:30.100368Z",
  "asset": {
    "provider": "github",
    "owner": "qt314wink",
    "repo": "Ocular-fractal-field",
    "commit_sha": "2026-08-21T11:05:46Z",
    "ref": "main"
  },
  "actor": {
    "type": "workflow",
    "id": "collect_repo_provenance"
  },
  "confidence": "supported",
  "claims": {
    "github_repo_id": 1334620842,
    "github_node_id": "R_kgDOT4yyqg",
    "language": null,
    "archived": false,
    "private": false,
    "fork": false,
    "description": null,
    "pushed_at": "2026-08-21T11:05:46Z",
    "created_at": "2026-08-14T22:24:42Z",
    "open_issues_count": 0
  }
}