{
  "event_id": "evt_ab81e18da53a69b0",
  "schema_version": "v1",
  "event_type": "asset.discovered",
  "occurred_at": "2026-09-01T10:46:30.099806Z",
  "asset": {
    "provider": "github",
    "owner": "qt314wink",
    "repo": "mcp-installer",
    "commit_sha": "2024-11-26T20:05:09Z",
    "ref": "main"
  },
  "actor": {
    "type": "workflow",
    "id": "collect_repo_provenance"
  },
  "confidence": "supported",
  "claims": {
    "github_repo_id": 1305882494,
    "github_node_id": "R_kgDOTdYvfg",
    "language": null,
    "archived": false,
    "private": false,
    "fork": true,
    "description": "An MCP server that installs other MCP servers for you",
    "pushed_at": "2024-11-26T20:05:09Z",
    "created_at": "2026-07-19T17:00:08Z",
    "open_issues_count": 0
  }
}