{
  "event_id": "evt_99735c20a8746728",
  "schema_version": "v1",
  "event_type": "asset.discovered",
  "occurred_at": "2026-10-01T06:07:22.777565Z",
  "asset": {
    "provider": "github",
    "owner": "qt314wink",
    "repo": "omni-loom-case-study",
    "commit_sha": "2026-09-08T21:03:56Z",
    "ref": "main"
  },
  "actor": {
    "type": "workflow",
    "id": "collect_repo_provenance"
  },
  "confidence": "supported",
  "claims": {
    "github_repo_id": 1276368647,
    "github_node_id": "R_kgDOTBPXBw",
    "language": "TypeScript",
    "archived": false,
    "private": false,
    "fork": false,
    "description": "Omni-Loom flagship case study \u2014 a deterministic generative compiler for cyber-physical creativity. Built with Next.js, TypeScript, Tailwind, and shadcn/ui.",
    "pushed_at": "2026-09-08T21:03:56Z",
    "created_at": "2026-06-21T22:29:30Z",
    "open_issues_count": 2
  }
}