{
  "event_id": "evt_948d2bb547a2db2b",
  "schema_version": "v1",
  "event_type": "asset.discovered",
  "occurred_at": "2026-08-01T08:03:52.589733Z",
  "asset": {
    "provider": "github",
    "owner": "qt314wink",
    "repo": "chromaflora-sitezip",
    "commit_sha": "2026-07-29T23:36:24Z",
    "ref": "main"
  },
  "actor": {
    "type": "workflow",
    "id": "collect_repo_provenance"
  },
  "confidence": "supported",
  "claims": {
    "github_repo_id": 1213255620,
    "github_node_id": "R_kgDOSFDPxA",
    "language": "HTML",
    "archived": false,
    "private": false,
    "fork": false,
    "description": "Imported from zip",
    "pushed_at": "2026-07-29T23:36:24Z",
    "created_at": "2026-04-17T07:37:00Z",
    "open_issues_count": 0
  }
}