{
  "event_id": "evt_5c832490dd62c1ad",
  "schema_version": "v1",
  "event_type": "asset.discovered",
  "occurred_at": "2026-09-01T10:46:30.098900Z",
  "asset": {
    "provider": "github",
    "owner": "qt314wink",
    "repo": "shader-gallery",
    "commit_sha": "2026-08-31T16:22:39Z",
    "ref": "main"
  },
  "actor": {
    "type": "workflow",
    "id": "collect_repo_provenance"
  },
  "confidence": "supported",
  "claims": {
    "github_repo_id": 1247977168,
    "github_node_id": "R_kgDOSmKe0A",
    "language": "JavaScript",
    "archived": false,
    "private": false,
    "fork": false,
    "description": "Interactive GLSL fragment shader collection \u2014 aurora, stained glass, psychedelic fluid & more. Live WebGL art.",
    "pushed_at": "2026-08-31T16:22:39Z",
    "created_at": "2026-05-24T03:01:02Z",
    "open_issues_count": 0
  }
}