{
  "event_id": "evt_394100e30086691a",
  "schema_version": "v1",
  "event_type": "asset.discovered",
  "occurred_at": "2026-08-05T08:17:24.351429Z",
  "asset": {
    "provider": "github",
    "owner": "qt314wink",
    "repo": "chromaflora-prime",
    "commit_sha": "2026-08-05T03:39:13Z",
    "ref": "main"
  },
  "actor": {
    "type": "workflow",
    "id": "collect_repo_provenance"
  },
  "confidence": "supported",
  "claims": {
    "github_repo_id": 1261976307,
    "github_node_id": "R_kgDOSzg68w",
    "language": "TypeScript",
    "archived": false,
    "private": false,
    "fork": false,
    "description": null,
    "pushed_at": "2026-08-05T03:39:13Z",
    "created_at": "2026-06-07T12:09:32Z",
    "open_issues_count": 3
  }
}