{
  "event_id": "evt_3b4b77c71a982939",
  "schema_version": "v1",
  "event_type": "asset.discovered",
  "occurred_at": "2026-09-01T10:46:30.099907Z",
  "asset": {
    "provider": "github",
    "owner": "qt314wink",
    "repo": "mcp-package-version",
    "commit_sha": "2026-01-28T12:14:12Z",
    "ref": "main"
  },
  "actor": {
    "type": "workflow",
    "id": "collect_repo_provenance"
  },
  "confidence": "supported",
  "claims": {
    "github_repo_id": 1305885278,
    "github_node_id": "R_kgDOTdY6Xg",
    "language": null,
    "archived": false,
    "private": false,
    "fork": true,
    "description": "An MCP server that provides LLMs with the latest stable package versions when coding",
    "pushed_at": "2026-01-28T12:14:12Z",
    "created_at": "2026-07-19T17:04:00Z",
    "open_issues_count": 0
  }
}