{
  "event_id": "evt_d98afded8ee69084",
  "schema_version": "v1",
  "event_type": "asset.discovered",
  "occurred_at": "2026-09-01T10:46:30.100163Z",
  "asset": {
    "provider": "github",
    "owner": "qt314wink",
    "repo": "motion",
    "commit_sha": "2026-07-01T08:38:21Z",
    "ref": "main"
  },
  "actor": {
    "type": "workflow",
    "id": "collect_repo_provenance"
  },
  "confidence": "supported",
  "claims": {
    "github_repo_id": 1294497532,
    "github_node_id": "R_kgDOTSh2_A",
    "language": null,
    "archived": false,
    "private": false,
    "fork": true,
    "description": "A modern animation library for React and JavaScript",
    "pushed_at": "2026-07-01T08:38:21Z",
    "created_at": "2026-07-09T01:25:02Z",
    "open_issues_count": 0
  }
}