{
  "event_id": "evt_526cc473444812d3",
  "schema_version": "v1",
  "event_type": "asset.discovered",
  "occurred_at": "2026-09-01T10:46:30.099955Z",
  "asset": {
    "provider": "github",
    "owner": "qt314wink",
    "repo": "mcp-server-calculator",
    "commit_sha": "2025-05-10T02:23:00Z",
    "ref": "main"
  },
  "actor": {
    "type": "workflow",
    "id": "collect_repo_provenance"
  },
  "confidence": "supported",
  "claims": {
    "github_repo_id": 1305881318,
    "github_node_id": "R_kgDOTdYq5g",
    "language": null,
    "archived": false,
    "private": false,
    "fork": true,
    "description": "A Model Context Protocol server for calculating.",
    "pushed_at": "2025-05-10T02:23:00Z",
    "created_at": "2026-07-19T16:58:41Z",
    "open_issues_count": 0
  }
}