{
  "event_id": "evt_1f8d400d37b302a7",
  "schema_version": "v1",
  "event_type": "asset.discovered",
  "occurred_at": "2026-07-20T08:40:46.598913Z",
  "asset": {
    "provider": "github",
    "owner": "qt314wink",
    "repo": "mcp-js",
    "commit_sha": "2026-07-06T20:37:57Z",
    "ref": "main"
  },
  "actor": {
    "type": "workflow",
    "id": "collect_repo_provenance"
  },
  "confidence": "supported",
  "claims": {
    "github_repo_id": 1305886178,
    "github_node_id": "R_kgDOTdY94g",
    "language": null,
    "archived": false,
    "private": false,
    "fork": true,
    "description": "MCP server that exposes a V8 JavaScript runtime as a tool for AI agents like Claude and Cursor. Supports persistent heap snapshots via S3 or local filesystem, and is ready for integration with modern AI development environments.",
    "pushed_at": "2026-07-06T20:37:57Z",
    "created_at": "2026-07-19T17:05:20Z",
    "open_issues_count": 0
  }
}