{
  "event_id": "evt_9685263250f315d1",
  "schema_version": "v1",
  "event_type": "asset.discovered",
  "occurred_at": "2026-07-14T07:47:30.771545Z",
  "asset": {
    "provider": "github",
    "owner": "qt314wink",
    "repo": "mandala-laser-system",
    "commit_sha": "2026-05-24T03:34:49Z",
    "ref": "main"
  },
  "actor": {
    "type": "workflow",
    "id": "collect_repo_provenance"
  },
  "confidence": "supported",
  "claims": {
    "github_repo_id": 1247990971,
    "github_node_id": "R_kgDOSmLUuw",
    "language": null,
    "archived": false,
    "private": false,
    "fork": false,
    "description": "Parametric SVG mandala generator for laser cutting \u2014 live browser configurator, exportable SVG patterns, fabrication settings for digital cutting.",
    "pushed_at": "2026-05-24T03:34:49Z",
    "created_at": "2026-05-24T03:34:48Z",
    "open_issues_count": 0
  }
}