{
  "event_id": "evt_a5e6ac8f7937e4fa",
  "schema_version": "v1",
  "event_type": "asset.discovered",
  "occurred_at": "2026-10-01T06:07:22.781283Z",
  "asset": {
    "provider": "github",
    "owner": "qt314wink",
    "repo": "godoc-mcp",
    "commit_sha": "2026-03-06T17:15:24Z",
    "ref": "main"
  },
  "actor": {
    "type": "workflow",
    "id": "collect_repo_provenance"
  },
  "confidence": "supported",
  "claims": {
    "github_repo_id": 1305878868,
    "github_node_id": "R_kgDOTdYhVA",
    "language": null,
    "archived": false,
    "private": false,
    "fork": true,
    "description": "MCP server that reduces LLM context usage when AI coding agents work with Go \u2014 structured documentation instead of source-file dumps.",
    "pushed_at": "2026-03-06T17:15:24Z",
    "created_at": "2026-07-19T16:55:56Z",
    "open_issues_count": 0
  }
}