{
  "event_id": "evt_e111a77e18fe76bf",
  "schema_version": "v1",
  "event_type": "asset.discovered",
  "occurred_at": "2026-08-01T08:03:52.592723Z",
  "asset": {
    "provider": "github",
    "owner": "qt314wink",
    "repo": "Project-Card-Manager",
    "commit_sha": "2026-06-01T21:53:33Z",
    "ref": "main"
  },
  "actor": {
    "type": "workflow",
    "id": "collect_repo_provenance"
  },
  "confidence": "supported",
  "claims": {
    "github_repo_id": 1214701988,
    "github_node_id": "R_kgDOSGbhpA",
    "language": "TypeScript",
    "archived": false,
    "private": false,
    "fork": false,
    "description": "Repository for https://replit.com/@qt314wink/Project-Card-Manager",
    "pushed_at": "2026-06-01T21:53:33Z",
    "created_at": "2026-04-18T23:42:44Z",
    "open_issues_count": 0
  }
}