{
  "event_id": "evt_554a1eb3f9283ae6",
  "schema_version": "v1",
  "event_type": "asset.discovered",
  "occurred_at": "2026-08-01T08:03:52.591157Z",
  "asset": {
    "provider": "github",
    "owner": "qt314wink",
    "repo": "lunar-myth-kintsugi-bible",
    "commit_sha": "2026-06-01T21:53:32Z",
    "ref": "master"
  },
  "actor": {
    "type": "workflow",
    "id": "collect_repo_provenance"
  },
  "confidence": "supported",
  "claims": {
    "github_repo_id": 1248060001,
    "github_node_id": "R_kgDOSmPiYQ",
    "language": "HTML",
    "archived": false,
    "private": false,
    "fork": false,
    "description": null,
    "pushed_at": "2026-06-01T21:53:32Z",
    "created_at": "2026-05-24T06:11:10Z",
    "open_issues_count": 0
  }
}